{
  "schemaVersion": "honua.slice/v1",
  "slug": "geoprocessing",
  "title": "Run a geoprocessing job",
  "variant": "map",
  "capabilityKeys": ["process.ogc-api-processes", "process.geoprocessing"],
  "sample": {
    "id": "gp-runner",
    "runtimeKind": "server"
  },
  "setup": {
    "console": {
      "state": "absent",
      "issue": "https://github.com/honua-io/honua-site/issues/219"
    },
    "cli": {
      "state": "absent",
      "issue": "https://github.com/honua-io/honua-sdk-js/issues/1424"
    },
    "adminApi": {
      "state": "absent",
      "issue": "https://github.com/honua-io/honua-site/issues/235"
    }
  },
  "use": {
    "js": {
      "state": "available",
      "install": "# Requires Node.js 22.12.0 or later.\nnpm install @honua/sdk-js@0.2.6",
      "snippet": "import { HonuaClient } from '@honua/sdk-js';\n\nconst client = new HonuaClient({ baseUrl: 'http://localhost:8080', apiKey: '<your-api-key>' });\nconst inputs = { wkb: { type: 'Point', coordinates: [-156.33, 20.8] }, distance: 0.01, srid: 4326 };\n\nconst processes = client.ogcProcesses();\nconst run = await processes.execute({ processId: 'geometry.buffer', mode: 'async', inputs });\nconst stopWatching = run.watch((snapshot) => console.log(snapshot.status));\ntry {\n    const output = await run.results({ deadlineMs: 30_000, maxAttempts: 20 });\n    console.log(output.outputs.outputFeatureLayer.value.geometry.type);\n} finally {\n    stopWatching();\n}"
    },
    "python": {
      "state": "partial",
      "issue": "https://github.com/honua-io/honua-sdk-python/issues/196",
      "install": "python3 -m pip install honua-sdk==0.1.18",
      "snippet": "from honua_sdk import HonuaClient\n\nclient = HonuaClient('http://localhost:8080', api_key='<your-api-key>')\ninputs = {'wkb': {'type': 'Point', 'coordinates': [-156.33, 20.8]}, 'distance': 0.01, 'srid': 4326}\n\ngp = client.geoprocessing()\njob = gp.submit_inputs('geometry.buffer', inputs)\nterminal = gp.wait(job, poll_interval=0.5, timeout=30.0)\noutput = gp.results(terminal.job_id)\nprint(output['outputFeatureLayer']['value']['geometry']['type'])"
    },
    "dotnet": {
      "state": "partial",
      "issue": "https://github.com/honua-io/honua-sdk-dotnet/issues/293",
      "install": "dotnet new console -o geoprocessing && cd geoprocessing\ndotnet add package Honua.Sdk --version 1.12.0",
      "snippet": "using System.Text.Json;\nusing Honua.Sdk.Processes;\n\nusing var http = new HttpClient { BaseAddress = new Uri(\"http://localhost:8080\") };\nhttp.DefaultRequestHeaders.Add(\"X-API-Key\", \"<your-api-key>\");\nvar processes = new HonuaProcessesClient(http);\nusing var timeout = new CancellationTokenSource(TimeSpan.FromSeconds(30));\nvar cancellationToken = timeout.Token;\nvar inputs = new Dictionary<string, JsonElement>\n{\n    [\"wkb\"] = JsonSerializer.SerializeToElement(new { type = \"Point\", coordinates = new[] { -156.33, 20.8 } }),\n    [\"distance\"] = JsonSerializer.SerializeToElement(0.01),\n    [\"srid\"] = JsonSerializer.SerializeToElement(4326),\n};\n\nvar job = await processes.SubmitJobAsync(\"geometry.buffer\", inputs, cancellationToken);\nwhile (job.Status is \"accepted\" or \"running\")\n{\n    await Task.Delay(500, cancellationToken);\n    job = await processes.GetJobAsync(job.JobId, cancellationToken);\n}\nvar output = await processes.GetJobResultsAsync(job.JobId, cancellationToken);\nConsole.WriteLine(job.Status);"
    },
    "mobile": {
      "state": "absent",
      "issue": "https://github.com/honua-io/honua-server/issues/2448"
    }
  },
  "ask": {
    "mcp": {
      "state": "absent",
      "issue": "https://github.com/honua-io/honua-server/issues/3269"
    }
  },
  "underneath": {
    "protocols": ["OGC API - Processes"],
    "evidencePage": "evidence-process-ogc-api-processes.html"
  },
  "related": []
}
